D1: OGSA Telecon schedule | E1: 2005.3.28
A3: Mon 5-7pm CST/CDT | D3: Free: +1-866-639-4741 Toll: +1-574-935-6703 PIN: 8980700
A4: Wed noon-2pt CST/CDT | D4: Call in: 800-664-6895 Toll: 719-955-1126 passcode: 285178
A5: Wed 5-7pm CST/CDT | D5: Free: +1-888-452-0308 Toll: +1-484-644-0505 PIN: 71815
A7: date | C7: time (CST/CDT) | D7: agenda | E7: leader
A8: 38434 | B8: Wed | C8: 5-7pm | D8: Basic Profile Discussion #1 | E8: Tom, David Snelling
A9: 38439 | B9: Mon | C9: 5-7pm | D9: GGF13 minutes approval Process & schedule discussion | E9: Hiro
A10: =A9+2 -> 38441 | B10: Wed | C10: noon-2pm | D10: Basic Profile Discussion #2 Security discussion | E10: Tom, David Snelling Frank, Takuya
C11: 5-7pm | D11: EGA feedback discussion | E11: Andrew, Jay, Hiro
A12: =A9+7 -> 38446 | B12: =B9 -> Mon | C12: =C9 -> 5-7pm | D12: Profile Template discussion #1 | E12: Dave Snelling
A13: =A10+7 -> 38448 | B13: =B10 -> Wed | C13: =C10 -> noon-2pm | D13: Basic Profile Discussion #3 Security discussion | E13: Tom, David Snelling
C14: =C11 -> 5-7pm
A15: =A12+7 -> 38453 | B15: =B12 -> Mon | C15: =C12 -> 5-7pm | D15: New WG status report Data design team (or WG) status report | E15: Andrew, Dave Berry, Mark
A16: =A13+7 -> 38455 | B16: =B13 -> Wed | C16: =C13 -> noon-2pm | D16: Basic Profile Discussion #4 | E16: Tom, David Snelling
C17: =C14 -> 5-7pm | D17: Roadmap discussion #1 | E17: Ian, Hiro
A18: =A15+7 -> 38460 | B18: =B15 -> Mon | C18: =C15 -> 5-7pm | D18: Profile template discussion #2 | E18: David Snelling
A19: =A16+7 -> 38462 | B19: =B16 -> Wed | C19: =C16 -> noon-2pm | D19: Basic Profile Final call (#5) | E19: Tom, David Snelling
C20: =C17 -> 5-7pm | D20: Roadmap discussion #2 | E20: Ian, Hiro
A21: =A18+7 -> 38467 | B21: =B18 -> Mon | C21: =C18 -> 5-7pm
A22: =A19+7 -> 38469 | B22: =B19 -> Wed | C22: 5-7pm | D22: Roadmap document final call (#3) | E22: Ian, Hiro
A23: =A21+7 -> 38474 | B23: =B21 -> Mon | C23: =C21 -> 5-7pm
A24: =A22+7 -> 38476 | B24: =B22 -> Wed | C24: =C22 -> 5-7pm
A25: =A23+7 -> 38481 | B25: =B23 -> Mon | C25: =C23 -> 5-7pm
A26: =A24+7 -> 38483 | B26: =B24 -> Wed | C26: =C24 -> 5-7pm | D26: New WG status report Data design team (or WG) status report | E26: Andrew, Dave Berry, Mark
A27: =A25+7 -> 38488 | B27: =B25 -> Mon | C27: =C25 -> 5-7pm
A28: =A26+7 -> 38490 | B28: =B26 -> Wed | C28: =C26 -> 5-7pm | D28: F2F preparation | E28: Hiro
A29: =A27+7 -> 38495 | B29: =B27 -> Mon | C29: =C27 -> 5-7pm | D29: No call (F2F meeting)
A30: 38497 | B30: =B28 -> Wed | C30: =C28 -> 5-7pm | D30: No call (F2F meeting)