D1: OGSA Telecon schedule | E1: 2005.07.21
A3: Mon 5-7pm CST/CDT | C3: Å@ | D3: Free: +1-866-639-4741 Toll: +1-574-935-6703 PIN: 8980700
A4: Wed 5-7pm CST/CDT | C4: Å@ | D4: Free: +1-888-452-0308 Toll: +1-484-644-0505 PIN: 71815
A6: date | B6: Å@ | C6: time (CST/CDT) | D6: agenda | E6: leader
A7: 38558 | B7: Mon | C7: 5-7pm | D7: OGSA WSRF Basic Profile Telecon schedule | E7: Tom, Takuya, David Snelling Hiro
A8: =A7+2 -> 38560 | B8: Wed | C8: 5-7pm | D8: OGSA WSRF Basic Profile final call | E8: Tom, Takuya, David Snelling
A9: =A8+5 -> 38565 | B9: Mon | C9: 5-7pm | D9: OGSA roadmap Architecture 1.5 | E9: Jem, Hiro Andreas, Jem
A10: =A8+7 -> 38567 | B10: =B8 -> Wed | C10: 5-7pm | D10: Resource Modelling | E10: Fred, Jay
A11: =A9+7 -> 38572 | B11: =B9 -> Mon | C11: 5-7pm | D11: Provisionig F2F preparation | E11: Dejan, Andrew
A12: =A10+7 -> 38574 | B12: =B10 -> Wed | C12: 5-7pm | D12: OGSA AuthZ-WG F2F Preparation OGSA roadmap | E12: Takuya, Frank Hiro, Andreas Jem, Hiro
A13: =A11+7 -> 38579 | B13: =B11 -> Mon | C13: 5-7pm | D13: No call (F2F) | E13: Å@
A14: =A12+7 -> 38581 | B14: =B12 -> Wed | C14: 5-7pm | D14: No call (F2F) | E14: Å@
A15: =A13+7 -> 38586 | B15: =B13 -> Mon | C15: 5-7pm | D15: No call | E15: Å@
A16: =A14+7 -> 38588 | B16: =B14 -> Wed | C16: 5-7pm | D16: Architecture 1.5 | E16: Andreas, Jem
A17: =A15+7 -> 38593 | B17: =B15 -> Mon | C17: 5-7pm | D17: Å@ | E17: Å@
A18: =A16+7 -> 38595 | B18: =B16 -> Wed | C18: 5-7pm | D18: Resource Modelling | E18: Fred, Jay
A19: =A17+7 -> 38600 | B19: =B17 -> Mon | C19: 5-7pm | D19: No call (Labor Day) | E19: Å@
A20: =A18+7 -> 38602 | B20: =B18 -> Wed | C20: 5-7pm | D20: Provisionig | E20: Dejan, Andrew
A21: =A19+7 -> 38607 | B21: =B19 -> Mon | C21: 5-7pm | D21: Architecture 1.5 | E21: Andreas, Jem
A22: =A20+7 -> 38609 | B22: =B20 -> Wed | C22: 5-7pm | D22: Profile Definition | E22: Tom, Dave Snelling
A23: =A21+7 -> 38614 | B23: =B21 -> Mon | C23: 5-7pm | D23: Resource Modelling | E23: Fred, Jay
A24: =A22+7 -> 38616 | B24: =B22 -> Wed | C24: 5-7pm | D24: OGSA AuthZ-WG | E24: Takuya, Frank
A25: =A23+7 -> 38621 | B25: =B23 -> Mon | C25: 5-7pm | D25: Architecture 1.5 GGF15 preparation | E25: Andreas, Jem Tom, Hiro
A26: =A24+7 -> 38623 | B26: =B24 -> Wed | C26: 5-7pm | D26: Profile Definition GGF15 Preparation | E26: Tom, Dave Snelling Tom, Hiro
A27: =A25+7 -> 38628 | B27: =B25 -> Mon | C27: 5-7pm | D27: No call (GGF15) | E27: Å@
A28: =A26+7 -> 38630 | B28: =B26 -> Wed | C28: 5-7pm | D28: No call (GGF15) | E28: Å@